activity_id,enriched_keywords
fb91ec4e-98f8-53c2-ad4d-1ed44028b015,"Membership, Social, Event, Gathering, Entertainment, Networking, Lounge, Venue, Experience, Celebration"
25cf905e-c111-5e0d-9334-1575341b3925,"intimacy, consent, relationships, pleasure, sexuality, attraction, communication, health, intimacy education, privacy"
03c51603-8b49-5a19-aed1-98b1bf0d8e30,"court, team, player, strategy, referee, match, training, defense, offense, league"
0db07e3f-6451-5ba1-9e18-c8330fe70098,"wellness, relaxation, geothermal, therapeutic, spa, mineral-rich, rejuvenation, nature, tranquility, hydrotherapy"
63660e96-8384-51b9-b189-df8bcfe0deff,"gut health, microbiome, digestive wellness, beneficial bacteria, fermentation, immune support, prebiotics, dietary supplements, health benefits, intestinal flora"
c5945008-4078-5293-8c7f-d9d25da915bb,"strike, spare, lane, pin, alley, score, ball, approach, approach, frame"
3eb52427-efb7-5e5c-a672-12bbf796b6fb,"bow, arrow, target, quiver,射箭, stance, release, draw weight, fletching, range"
176839a2-9c3e-596d-b1b1-4a77ba16f3cf,"worship, fellowship, community, spirituality, service, prayer, scripture, ministry, congregation, devotion"
1bd92b1c-1c91-537c-938e-9a0243bff017,"relaxation, wellness, heat therapy, hydration, detoxification, muscle recovery, stress relief, cardiovascular health, skin rejuvenation, breathing techniques"
3eef0f92-5b52-580a-a3b5-e9b6399cb1bf,"outdoors, hiking, backpacking, wilderness, adventure, nature, survival, exploration, relaxation, campfire"
981aef3f-cf4c-5b6f-88b1-2660ad3dd679,"balance, strength, flexibility, inversion, core stability, body alignment, endurance, posture, coordination, fitness"
fb1ae6ce-63e5-5b31-be56-15bfe56f8f17,"fitness, endurance, agility, teamwork, coordination, challenge, strategy, training, motivation, performance"
11a8adb4-16a2-5cfe-9412-f583056b72d1,"snow, trails, endurance, technique, equipment, fitness, weather, terrain, conditions, preparation"
67de7908-6f4c-5a41-a2ba-f1e7a00e73c4,"Radiation, Photosynthesis, Ultraviolet, Solar Energy, Vitamin D, Illumination, Climate, Atmosphere, Spectrum, Heat"
9f2bdd86-8380-5a79-a426-d0c0061b7aca,"mass, gravity, measurement, balance, force, kilograms, pounds, scale, density, resistance"
606ae6ec-ec20-5362-9d10-79a81bfba3f9,"hair removal, beauty treatment, skin exfoliation, salon services, aesthetics, smooth skin, body care, personal grooming, cosmetic procedures, self-care"
815db158-0e6a-5d40-b54f-365cae33cbb5,"rowing technique, fitness training, endurance, water sports, muscle strength, competition, team dynamics, cardiovascular health, performance improvement, equipment maintenance"
8870faea-30d4-52db-9659-8c75a0ba9ce3,"Cardio, Endurance, Fitness, Health, Training, Exercise, Performance, Pedals, Routes, Gear"
527e3c27-bdd5-5df6-8cee-2310ca802366,"rest, sleep, rejuvenation, relaxation, downtime, energy recharge, mental health, circadian rhythm, wellness, self-care"
b9630dae-233d-52a8-ad5f-9eb3641e8e53,"recovery, relaxation, rejuvenation, wellness, self-care, mindfulness, balance, restoration, mental health, physical recovery"
b420c46c-5e91-5171-b308-089d1d068d06,"batting, pitching, fielding, home run, strikeout, base running, outfield, infield, glove, umpire"
4bcdf28d-03db-59e7-b731-e2ed13e4c45d,"reflection, creativity, expression, mindfulness, organization, documentation, introspection, planning, analysis, inspiration"
45cbe4d6-2b12-53f3-90cc-cd8f5da3442c,"hoops, court, dribbling, shooting, defense, rebound, assist, layup, three-pointer, strategy"
c9537d01-0d7c-53fa-a9ed-54781075a22d,"Birdie, Par, Eagle, Fairway, Green, Tee, Bunker, Caddy, Stroke, Putter"
07131afc-bdd1-5040-9eef-f636dc56d11b,"strength, stability, balance, endurance, flexibility, posture, resistance, mobility, fitness, rehabilitation"
7308b549-abe5-5494-bd55-002c259040cc,"recovery, support, mindfulness, wellness, resilience, community, health, awareness, coping, transformation"
420439f2-d1c7-5ec4-a3cb-60bdf40e1376,"tricks, ollie, grind, deck, wheels, safety gear, skate park, ramps, balance, freestyle"
0f45c744-2957-54fc-82b7-6ea0dd9fd8a3,"Athletics, Competition, Spectators, Team, Fans, Venue, Championship, Tournament, Scoreboard, Event Management"
6d2a19e6-b3c6-5bf3-b12c-376608bd9162,"rehabilitation, mobility, recovery, strength, exercises, pain management, assessment, flexibility, wellness, functional movement"
8666c655-8971-53c4-81c9-31d4bb6288bd,"water sports, outdoor recreation, aquatic activities, physical fitness, balance skills, adrenaline rush, competition, summer activities, wave riding, equipment maintenance"
ae9673db-b72e-57cd-a542-74369fc86753,"discipline, technique, self-defense, combat, training, fitness, flexibility, strategy, competition, respect"
f04fa7df-b8bc-5307-ab80-7295850e1981,"Live music, ticket sales, performance venue, audience engagement, sound system, stage setup, artist lineup, promotional materials, merchandise sales, crowd management"
790cddb1-06a7-52fd-ad16-31894f77fe33,"ingredients, recipes, cuisine, preparation, baking, seasoning, technique, plating, nutrition, utensils"
7d522063-e3ba-5416-bf0c-51dfa16a9757,"aerial, adventure, flight, altitude, wind, harness, scenery, navigation, enjoyment, thrill"
8e705df7-86e6-53f4-992a-3eb62beecd13,"backcountry, snow conditions, avalanche safety, gear selection, trail navigation, mountain weather, fitness training, route planning, environmental awareness, ski technique"
80625daf-e32d-50d1-8bf7-440522bcfee9,"baseball, team sports, recreational games, outdoor activities, exercise, youth sports, fitness, competition, coordination, strategy"
f0bf16c1-8419-5a14-ae5b-dc9cc79f8f1e,"Wildlife, tracking, camouflage, conservation, firearms, archery, wilderness, habitat, ethics, regulations"
19d30981-bc86-545c-97e4-53d1a3db2313,"Vertical, Ascend, Grip, Rockface, Summit, Bouldering, Crux, Hold, Traverse, Belay"
