activity_id,enriched_keywords
e678bea2-53e4-53f0-b29e-41df0315816e,"oral hygiene, dental care, plaque removal, gum health, teeth cleaning, interdental cleaning, fresh breath, oral health, preventive care, toothbrush"
20f197d8-38e9-562b-ad1d-0ae6d2304963,"bodyweight training, strength building, flexibility, endurance, functional fitness, mobility, posture improvement, workout routines, core stability, muscle control"
29e948ba-6a22-5712-b0a1-5dc2971fb84f,"meditation, spirituality, reflection, worship, devotion, faith, mindfulness, guidance, community, connection"
e608ee38-c8ca-5384-bd0f-54a32ddfafd5,"fitness, coordination, rhythm, exercise, agility, flexibility, balance, fun, dance, workout"
8ca4de14-b3b3-5556-b1a9-7572068c1d7c,"tobacco, addiction, health risks, cessation, secondhand smoke, respiratory issues, nicotine, lung cancer, social stigma, public policy"
8a0ea615-9f6c-5f96-a916-1a112329d279,"Beverages, Refreshments, Non-alcoholic, Soft drinks, Juices, Smoothies, Infusions, Carbonated drinks, Tea, Coffee"
f38a79f1-495c-5e42-a661-646e80d9acf3,"Irrigation, Horticulture, Soil Moisture, Plant Care, Fertilization, Growth Environment, Hydroponics, Gardening, Ecosystem, Nutrient Absorption"
deb94022-33d7-5020-aa86-ca2efc86aa23,"waves, ocean, board, swell, tide, beach, competition, maneuver, style, session"
0ede326d-522d-53f5-ae0e-7540b0816e77,"Training, Sparring, Footwork, Conditioning, Technique, Endurance, Strategy, Punching, Defense, Agility"
50518eae-1753-50d8-89eb-62f4e2991503,"Cuisine, Recipe, Cooking, Ingredients, Meal Prep, Dietary, Nutrition, Culinary, Flavor, Presentation"
1281a1f8-c2b1-5d30-994d-2ba35d3fae3d,"cycle, health, hygiene, fertility, symptoms, products, education, wellness, discomfort, tracking"
22a91a4a-61b8-5686-b0a5-aaf5f7b265a4,"Ascent, altitude, terrain, harness, belay, foothold, crux, summit, bouldering, safety"
dd424672-11e2-5f5a-a695-f84ecdb17251,"aerobic exercise, resistance training, cardiovascular health, muscle toning, joint flexibility, aquatic therapy, calorie burning, stamina building, low-impact workout, health benefits"
127162ea-ed94-53a4-a356-e775ca07c159,"romance, relationship, planning, communication, intimacy, connection, schedule, outing, experience, engagement"
cf89ab22-afb6-5750-8896-4f4edc2d7d16,"mental health, counseling, emotional support, well-being, self-care, mindfulness, coping strategies, personal growth, psychological resilience, interpersonal relationships"
d9e31dca-a449-5cfd-854a-52ceeaa328ae,"Nutrients, Supplements, Deficiency, Absorption, Minerals, Antioxidants, Health, Dietary, Metabolism, Bioavailability"
13d13031-dffb-5e15-87dc-1e842435b1a5,"Pilates, strength training, flexibility, core stability, low-impact workout, isometric exercises, balance, alignment, mind-body connection, fitness class"
ed9e0e06-9618-5649-8435-9fea1c970a16,"teamwork, agility, strategy, athleticism, competition, endurance, sportsmanship, coordination, playbook, camaraderie"
f20ef3f5-aebe-5045-a1da-c2cf7846f7c4,"budgeting, financial management, cost tracking, spending analysis, cash flow, financial planning, receipt organization, expense reporting, monetary allocation, household budgeting"
1b5f4957-2ddd-5436-ad72-f6f6361f2762,"Detoxification, Purification, Wellness, Hydration, Renewal, Rejuvenation, Natural Remedies, Health Regimen, Mindfulness, Holistic Approach"
e04490ea-83ff-5bfc-bf51-268a98dcb88c,"business trip, travel itinerary, expense report, accommodation, conference, networking, flight booking, transportation, travel policy, productivity tools"
85e20d41-12d7-5e78-8ea7-d4c705e8ec4d,"winter, outdoor recreation, hiking, snow, terrain, fitness, nature, trails, equipment, adventure"
1a359ccd-a5d2-57fc-8dc1-91a57bcb7009,"underwater exploration, marine life, snorkeling, dive gear, buoyancy control, dive safety, coral reefs, pressure changes, decompression stops, underwater photography"
a67e680e-460a-5941-9fa8-56bf5a2ebce6,"Strength, Fitness, Endurance, Resistance, Training, Muscle, Power, Conditioning, Repetition, Performance"
6f64bdd9-4325-555f-bb04-5971164a883d,"Aquatic, exercise, fitness, endurance, competition, technique, safety, training, relaxation, therapy"
139073e1-66d0-5e84-b5f8-016bb4b930cd,"respiration, oxygen, inhalation, exhalation, lung capacity, diaphragm, pulmonary function, mindfulness, relaxation, ventilation"
c86bc0da-4ef1-5d35-8daf-7564339102cf,"Retail therapy, online marketplace, consumer goods, price comparison, shopping cart, seasonal sales, checkout process, product reviews, discount codes, gift shopping"
50e07fb4-e6bb-5193-b70b-db56b94e1a3c,"Balance, Agility, Speed, Coordination, Tricks, Jumps, Stunts, Maneuvers, Surface, Safety"
92e0fba6-25a8-5fe9-b559-ada7972421c4,"Nutrition, Hydration, Vitamins, Freshness, Antioxidants, Extraction, Blending, Refreshment, Flavor, Health"
2d1e0bcd-10fb-56d5-a37c-065535d6b695,"Yoga, Pilates, Stretching, Home Workout, Bodyweight Exercises, Fitness Routine, Flexibility, Balance, Mindfulness, Recovery"
5ca919b2-5b4d-59c5-ba55-fd509a9bdef0,"Staircase, Elevation, Ascent, Descent, Safety Rail, Footing, Tread, Railing, Landing, Access"
2e77d69c-7cdf-5092-b422-c8cef2f5657e,"mobile testing, software quality assurance, automated testing, user interface testing, performance evaluation, debugging techniques, test case development, device compatibility, functional testing, test automation frameworks"
100cbd92-331c-5a05-a9f2-428e9cabc4b5,"Trauma, Rehabilitation, Pain, Recovery, Treatment, Therapy, Diagnosis, Prevention, Symptoms, Mobility"
68147d7a-a4d5-5970-a71a-04e4067577d1,"recreation, bonding, exploration, adventure, leisure, togetherness, sightseeing, engagement, nature, enjoyment"
81854450-6c8a-5b99-8ed1-b90124b0cb85,"pelvic floor, muscle strength, urinary health, core stability, sexual wellness, rehabilitation exercises, postpartum recovery, incontinence management, pelvic alignment, women's health"
3f31c095-2179-5cbe-925e-bc1f4f2d597f,"digestion, gastrointestinal, health, stool, regularity, fiber, hydration, colon, wellness, constipation"
0565bdfc-51a5-54df-b83c-fb2baf12a305,"dirt bike, off-road, racing, suspension, throttle control, jumps, tracks, protective gear, stunts, adrenaline"
370dc58b-3eb5-5f50-a1e3-36a14e563576,"Resistance, Hypertrophy, Endurance, Reps, Sets, Muscle, Load, Recovery, Form, Conditioning"
881d88f7-d2ef-56a6-9022-9603eaeb31fc,"photobiomodulation, infrared, skin rejuvenation, healing, inflammation reduction, collagen production, pain relief, light wavelengths, cellular energy, therapeutic benefits"
0898b4a2-fa32-544a-b5ca-eb87ac0d675a,"goal, strategy, teamwork, referee, match, training, tactics, championship, fanbase, skill"
0b43c0a1-9849-5f47-b11e-2f2aed897e49,"Pace, Endurance, Stamina, Distance, Warm-up, Cool-down, Cadence, Form, Stride, Recovery"
d30c2ded-d48d-5e0e-bee1-80244f8b193d,"strength training, weightlifting, resistance exercise, muscle building, fitness regimen, gym equipment, physical conditioning, powerlifting, exercise routine, athletic performance"
c67f6787-3818-52f1-8094-49f25135337b,"athletics, competition, sprinting, long jump, hurdles, relay, pole vault, endurance, coaching, training"
a3b4e90d-6e1f-57e0-befd-95303617441b,"lactation, newborn nutrition, maternal health, breastfeeding benefits, infant bonding, nursing techniques, milk supply, feeding schedule, postpartum care, breastfeeding support"
4f013de6-b34e-5824-a36d-12c40a53a51d,"diversity, innovation, collaboration, flexibility, adaptability, creativity, exploration, integration, engagement, versatility"
b57cf1ea-e4f4-5371-b6b5-cda5502fb173,"rest, relaxation, circadian rhythm, bedtime, slumber, rejuvenation, fatigue, dream, health, tranquility"
52ce9f13-395b-5a7a-86ac-12c8c4f32dd3,"Nail care, Nail art, Nail design, Nail health, Nail polish, Nail tools, Nail growth, Nail maintenance, Nail treatments, Nail hygiene"
a1629b84-7e9d-5969-a5d6-2748be284a7e,"celebration, networking, socializing, entertainment, refreshments, invitations, decor, music, venue, theme"
d3b5f485-9578-53b7-ac97-b5fb3df43bc7,"workshop, training, learning, engagement, collaboration, discussion, facilitation, participation, feedback, brainstorming"
88e81fb1-3384-5dc8-9163-d6cb4f6f85b4,"anxiety, stress, coping strategies, mental health, breathing techniques, mindfulness, triggers, self-care, therapy, emotional regulation"
c5a630d8-c585-5c19-bbc7-604dbcb74334,"literacy, comprehension, analysis, narrative, annotation, engagement, interpretation, fluency, discernment, vocabulary"
45f7c242-baab-5cba-be1c-8d96ea98a471,"cardiovascular, fitness, endurance, training, workout, resistance, motion, health, exercise, performance"
e8791fb3-bbcc-57e6-8371-b8d1eff192fa,"snow, slopes, winter, mountains, equipment, altitude, technique, gear, trails, avalanche"
8d14b250-6fbd-53dc-960f-1d6830344ac9,"motorcycle, off-road, terrain, maneuverability, suspension, throttle, adrenaline, safety gear, trails, jumps"
fdc943fb-b2db-50f9-9622-97f61072cc50,"fitness, training, workout, cardio, conditioning, agility, endurance, strength, competition, technique"
c7c06888-4e15-5512-8d1e-309adf04d6b3,"communication, mobile, connectivity, technology, call, text, application, network, device, wireless"
e4412705-dbf1-5726-8dcc-2962cc4c7b9a,"Productivity, Collaboration, Innovation, Workflow, Time Management, Engagement, Communication, Efficiency, Planning, Performance"
29e017a0-fc34-50bc-97bb-197d2a720238,"nutrition, mindfulness, health tracking, meal planning, dietary habits, food diary, calorie counting, portion control, wellness, self-reflection"
68e96e11-96c8-5cc2-b8b0-9a4529fdfe98,"fitness, endurance, strength, flexibility, conditioning, rehabilitation, performance, agility, workout, versatility"
efbdbb4f-71e0-5e1b-b0eb-5d706cbcea36,"goal, referee, pitch, dribble, offside, teamwork, strategy, training, match, player"
16871b7e-1810-5859-9cdd-5b5ac919cc21,"exercise, fitness, wellness, health, movement, strength, endurance, agility, rehabilitation, performance"
c59adbe5-0222-5af3-8f6e-73c490a498ec,"Administration, Prescription, Dosage, Adherence, Side Effects, Interaction, Formulation, Route of Delivery, Monitoring, Compliance"
8e0dc783-93a1-57dc-b736-4094b4e11611,"Resort, Adventure, Relaxation, Itinerary, Exploration, Culture, Accommodation, Sightseeing, Wellness, Experience"
9beceaf3-046c-5d31-8a4a-6382672707eb,"bronze, sunless, skin, tanning solution, UV-free, glow, bronzer, pigmentation, moisturizer, beauty treatment"
60fb715e-7e98-5e08-9da6-04f7c182fd1f,"Fever, Nausea, Fatigue, Headache, Symptoms, Infection, Wellness, Recovery, Consultation, Treatment"
761cee39-9bea-5f2a-81ff-909e722d54e5,"Aquatic therapy, Rehabilitation, Water exercise, Physical therapy, Pain relief, Mobility enhancement, Wellness, Relaxation techniques, Circulation improvement, Muscle recovery"
a199cbf9-418e-5ea0-9d3e-90a3a87a566d,"Immunization, Vaccination, Health, Disease Prevention, Public Health, Side Effects, Syringe, Dosage, Healthcare Provider, Adverse Reactions"
e07eaa92-24a1-540f-80ec-44c07257f6df,"vehicle, transportation, mobility, engine, road, travel, maintenance, fuel, safety, navigation"
e9e5d45a-1e33-5803-8614-ee2dd87ce8f2,"rally, serve, spin, paddle, rally scoring, backhand, forehand, smash, footwork, net height"
7b5ade87-ec83-5cbb-8567-9ea0440edee7,"adventure, river, rapids, paddling, teamwork, safety, navigation, wilderness, thrill, exploration"
333f4d52-e05c-5aed-a009-43fdc73b4758,"travel, itinerary, accommodations, meetings, expenses, networking, logistics, productivity, scheduling, transportation"
d265fab5-6985-5f20-8449-95f26857da33,"laboratory tests, diagnostic analysis, health screening, blood sample, clinical chemistry, hematology assessment, disease monitoring, biomarker evaluation, preventive care, patient health"
853d261e-06e3-5385-8b2a-bc74b23da400,"spirituality, meditation, prayer, worship, faith, reflection, mindfulness, ritual, belief, community"
182a8a16-1618-51a4-86b8-c5481f52f787,"ice, stone, rink, skip, sweep, rock, score, end, house, delivery"
d1376acf-b83a-50b7-a520-a6c90dcdecfd,"Research, Analysis, Review, Comprehension, Synthesis, Evaluation, Memorization, Observation, Application, Engagement"
447ba779-1f8b-5f16-918e-77fd8b67f356,"flexibility, rehabilitation, muscle activation, proprioception, range of motion, contract-relax, neuromuscular, stretching techniques, athletic performance, injury prevention"
a42c4d0a-dd38-5fa0-acd3-7692f4f8388a,"swordsmanship, tournament, bout, en garde, lunge, parry, fencing mask, epée, foil, sabre"
6c2d570c-bc8d-58e4-8aa0-e2a13f505e5f,"hearing, sound sensitivity, ear health, auditory system, noise exposure, hearing loss, acoustic therapy, sound masking, ear ringing, audiology"
7d8c6ded-8ea9-5f14-bcf5-308f45335d5c,"adventure, outdoor, canopy, thrill, experience, nature, heights, safety, equipment, tourism"
ddf32b33-d9ae-5b87-95f2-0a0c67f87c64,"grappling, mat, pinning, takedown, submission, referee, weight class, championship, technique, stamina"
8aacc13b-574f-5b50-9d7a-63c1b6d79377,"putting, driving, fairway, disc selection, chains, course layout, tournament, par, approach shots, throw technique"
824d20db-cc0f-507d-9838-962633f460c2,"endurance, fitness, metabolism, heart rate, stamina, aerobic, training, interval, energy expenditure, health"
44dea516-7df1-5636-b5f4-c5ffb8c033d7,"Coping strategies, Relaxation techniques, Mindfulness practices, Emotional regulation, Cognitive behavioral therapy, Breathing exercises, Self-care routines, Time management, Support systems, Resilience building"
100073e3-fcb1-5cc9-9598-7f3dd859758d,"choreography, rhythm, movement, expression, performance, creativity, technique, coordination, training, flexibility"
fbc2ee1c-6939-558f-a080-624876e7b567,"Fertilization, Aeration, Weeding, Watering, Mulching, Soil Testing, Pest Control, Grass Seeding, Edging, Turf Management"
9e0e7ce1-c99d-517a-b6b5-e081be2d2222,"asthma, respiratory distress, bronchospasm, lung function, inhalation, oxygen saturation, airway inflammation, cough reflex, pulmonary health, allergic reaction"
396d1850-fcf8-59fe-93fe-85b5b8dc8dc5,"skates, puck, ice rink, penalty, stickhandling, faceoff, defenseman, power play, slap shot, referee"
34f79cb7-d444-56df-a1af-13e4a0b7220d,"water recreation, outdoor adventure, leisure activities, summer fun, nature exploration, float trips, scenic waterways, relaxation, group outings, eco-friendly tourism"
925a01b6-d9c1-5908-bdd1-6b460f414db5,"fitness, strength, conditioning, endurance, workout, training, nutrition, community, competition, motivation"
ccbdf98f-cddb-5242-a68b-ce69fc0880c8,"flexibility, mobility, relaxation, warm-up, recovery, posture, endurance, muscle, balance, tension"
f1da5f9b-e9f3-5dd8-a371-c17b21b51e33,"broadcast, entertainment, streaming, series, episodes, viewers, ratings, schedule, cable, media"
3beadadb-24d8-5391-a7be-9b882467cbd3,"eSports, multiplayer, gameplay mechanics, character customization, game design, virtual reality, streaming, community engagement, in-game purchases, user interface"
2b1ab2d6-641d-57e3-a2d4-bc3ab26a9b68,"goal, court, referee, teamwork, strategy, passing, dribbling, defense, scoring, timeout"
6e0d91f2-49dd-5018-896f-681a212cd475,"High-intensity, cardio workout, interval training, metabolic conditioning, endurance training, strength training, fitness regimen, circuit training, calorie burn, athletic performance"
6a258edd-c7c1-594d-9794-e5ffb6cf93be,"mentorship, guidance, development, training, empowerment, feedback, motivation, assessment, skills, performance"
a308068e-8f1e-5528-b1de-885a0938484c,"dance, performance, choreography, technique, grace, movement, rhythm, expression, artistry, elegance"
cd2deb67-060b-513a-a584-5dc329b61681,"mindfulness, relaxation, awareness, breathing, concentration, tranquility, focus, introspection, stress relief, presence"
2f51aad2-bc70-58fe-9891-fe06df4cb885,"freestyle, terrain park, powder, carving, bindings, goggles, slope, chairlift, avalanche, snowboard gear"
8e6f6878-926f-545d-a5df-18414e836beb,"Karateka, kata, kumite, martial arts, self-defense, discipline, technique, sparring, belt ranking, dojo"
30cdb035-f8b9-5a5b-a46b-8afbbe158c3a,"Intermittent, Metabolism, Nutrition, Health, Detoxification, Mindfulness, Weight Loss, Autophagy, Energy, Blood Sugar"
3efaf8be-0564-551c-ba2b-1d6aacdba0b2,"horticulture, soil, planting, irrigation, compost, propagation, pest control, landscaping, pruning, biodiversity"
852fa3c3-cd2f-5ea8-9d92-569f91c03984,"oral health, tooth decay, dental hygiene, orthodontics, periodontal disease, cavity prevention, restorative dentistry, dental exams, fluoride treatment, cosmetic dentistry"
104d5448-7afb-5efe-9da6-7b47f11748dc,"video on demand, live broadcasting, content delivery, digital media, over-the-top services, interactive viewing, subscriber model, bandwidth usage, cross-platform access, media streaming technology"
c999708a-9373-5714-856e-87f8f7d12d03,"mushing, winter sports, snow travel, canine teamwork, sled dogs, arctic adventure, cold weather gear, outdoor exploration, animal training, recreational racing"
ae96404a-d01e-5d4a-a294-ffc8bffac986,"sketch, illustrate, design, render, depict, outline, compose, draft, blueprint, visualize"
4cc6fd6a-54e3-5490-bbe0-0d315c6127c4,"ceremony, reception, vows, invitations, attire, catering, photography, decorations, venue, planning"
06b950be-8a77-5bc1-8524-ad30e5701c0b,"cinema, film, storytelling, screenplay, audience, director, cinematography, editing, genre, box office"
eb709a6c-f4d9-593d-ae83-8c7d62b54708,"muscle tension, trigger points, pain relief, myofascial release, rehabilitation, physical therapy, acupuncture, sports injuries, tissue repair, holistic treatment"
ad172d5b-e28b-5e3e-bb6f-46311cd19680,"breathwork, energy cultivation, mindfulness, meditation, holistic healing, self-awareness, movement practice, relaxation techniques, body awareness, spiritual growth"
fafb3063-75ef-5fcb-ad22-39304ac04893,"cold therapy, recovery, inflammation reduction, muscle soreness, pain relief, wellness, blood circulation, athletic performance, skin rejuvenation, therapeutic treatment"
00c95925-b8fb-5451-be92-378bd428a20a,"Navigation, Wind, Sail, Hull, Anchor, Nautical, Regatta, Tides, Chart, Marina"
0b7bddd5-4541-59eb-a0b7-23cf6bcb4d47,"fitness, choreography, strength training, flexibility, performance art, body confidence, athleticism, movement, dance style, rhythm"
e6045d0a-17d7-5612-9bd5-700a0753b049,"oral health, dental care, tooth extraction, cavity prevention, orthodontics, periodontal disease, dental hygiene, teeth whitening, root canal, dental implants"
7f4c9d8f-91f3-5e0e-8f0c-c63d79e59bec,"Meditation, Mindfulness, Breathwork, Flexibility, Balance, Alignment, Wellness, Stress Relief, Meditation, Holistic Health"
19aca369-c8e0-5046-b343-eae74e1bc383,"paddling, watercraft, river, lake, outdoor adventure, recreation, wildlife, navigation, safety gear, teamwork"
647223e3-ff67-597d-bea4-6b188ea08872,"Fitness, Strolling, Exercise, Outdoors, Health, Mobility, Endurance, Routine, Leisure, Exploration"
0c5f4897-609c-59df-b938-8aaa7cc1176d,"horseback riding, dressage, show jumping, eventing, equestrian competitions, riding techniques, horse care, saddle fitting, equine health, rider training"
e01df0d5-76c6-55ed-aec4-e245f62f9300,"Birthday, Graduation, Retirement, Promotion, Anniversary, Birth, Memorial, Reunion, Vacation, Celebration"
a23b5067-a94c-50f8-a2ba-ab29ec7c3b8d,"relocation, transport, logistics, transition, change, travel, delivery, shipment, unpacking, coordination"
e6078694-0a16-5264-b47d-457603aad113,"companionship, socializing, bonding, support, communication, trust, laughter, activities, gatherings, memories"
e69abe3c-4380-5123-b26c-069e08228b8d,"Melody, Rhythm, Harmony, Composition, Chords, Improvisation, Soundscapes, Performance, Notation, Engagement"
13e3685d-120b-597c-8c59-957d7e5ae0ed,"shopping, groceries, transportation, appointments, bills, deliveries, supplies, scheduling, tasks, time management"
fb52afcf-8aa0-5932-ab3f-89ad00a967fe,"heart rate variability, autonomic nervous system, stress response, recovery metrics, cardiovascular health, wellness monitoring, physiological resilience, fitness assessment, biofeedback, health optimization"
d9ef5357-3864-5284-ae46-c3fc9b014810,"brew, roast, espresso, aroma, caffeine, barista, filter, blend, mug, grounds"
e21fe419-ef94-5939-bbe5-d9a6e12b24d7,"Organizing, Maintenance, Tidying, Disinfecting, Decluttering, Grooming, Arranging, Sanitizing, Sorting, Upkeep"
f2a21e75-ae92-56b1-b85b-b342c6de30f1,"skincare, beauty, treatment, rejuvenation, cleansing, massage, hydration, exfoliation, relaxation, aesthetics"
14447054-b475-51ba-bb70-d394bccf9044,"fitness, flexibility, posture, core strength, balance, rehabilitation, mindfulness, endurance, alignment, wellness"
922a95c6-b479-5f44-af44-228d078fe4c5,"racquet, court, serve, volley, net, score, paddle, game, tournament, strategy"
b3f15391-f1b5-56ae-b1ff-e78495b39ab8,"relaxation, hygiene, skincare, aromatherapy, self-care, wellness, cleansing, tranquility, ritual, rejuvenation"
aef61ca1-0b4a-5b12-aeb0-cb33be521fe2,"scheduling, organization, task management, time allocation, project coordination, resource planning, goal setting, deadline tracking, prioritization, efficiency"
d6741f30-2a15-57e8-bcbb-c58a913ecb15,"firearms, target practice, ammunition, marksmanship, safety protocols, gun handling, shooting techniques, range etiquette, competition shooting, ballistic analysis"
d092d4fc-ea8d-58ca-971e-c5a6c65acee2,"racket, shuttlecock, court, serve, rally, net, grip, footwork, scoring, doubles"
6b22ab7a-7f9d-5bed-9ff8-d6406809a421,"stickhandling, faceoff, groundball, attack, defense, midfield, cleats, checking, goalie, offense"
64993a40-a339-5c17-9674-8cab8c208939,"patient care, diagnosis, treatment, health assessment, medical history, clinical examination, prescription, follow-up, healthcare provider, medical consultation"
1574a40d-17b1-5331-982e-d1c7d808420b,"racquet, court, serve, volley, rally, point, game, match, score, strategy"
45da7e21-ae98-57e2-9207-ab7862b658d9,"flexibility, balance, strength, coordination, acrobatics, routines, apparatus, tumbling, agility, performance"
32bba106-55e2-507a-bd07-59ab3d486847,"yarn, hook, stitch, pattern, gauge, fiber, tension, project, design, row"
947de72e-aac4-51b2-b146-408315c09110,"styling, grooming, haircare, maintenance, appointment, salon, barber, trimming, consultation, texture"
b0d1e637-4c98-5b36-8eda-46420190dda2,"goal, referee, strategy, competition, teamwork, endurance, training, tactics, scoring, league"
c179cbf7-e7dc-5c61-b468-e3ad7563f2d9,"Hydration, Conservation, Pollution, Quality, Aquifer, Ecosystem, Treatment, Supply, Resource, Cycle"
3bee367c-f6b6-5dae-bda4-2e3813ab0ce5,"bat, ball, wicket, bowler, batsman, innings, run, score, pitch, umpire"
c07b4ff9-a962-5267-b41e-5d667d199661,"scrum, try, tackle, ruck, lineout, penalty, conversion, forward, backline, referee"
3bc8434b-7fcc-5403-b679-f5356116f329,"racquet, court, serve, rally, gameplay, scoring, strategy, fitness, agility, competition"
c4fc9dfa-b272-5476-926d-524f4b19964f,"relaxation, detoxification, heat therapy, wellness, steam, aromatherapy, cardiovascular health, muscle recovery, meditation, spa experience"
d8716c0a-ba51-5b49-8bd1-43a601a8b018,"batting, pitching, fielding, baserunning, strategy, teamwork, equipment, training, competition, scorekeeping"
ab7b3e31-0081-513c-87d0-4dd24a19a48c,"spike, serve, set, dig, block, rally, court, libero, rotation, setter"
c3c6b5bf-6fef-588d-a3d4-6af7b0b5e716,"migraine, tension, pain relief, symptoms, treatment, diagnosis, triggers, medication, neurology, wellness"
b629d3bc-c943-5a7e-bd8b-030f11a3e507,"paddling, watercraft, adventure, navigation, outdoor recreation, endurance, safety equipment, natural exploration, teamwork, fitness"
bce5b280-977d-543f-b56d-20b1e3b3bc2f,"trails, wilderness, nature, exploration, fitness, adventure, scenery, outdoor, terrain, endurance"
83b3f160-bb5c-593b-905c-edf1e726c9d8,"outdoors, hiking, backpacking, wilderness, nature, campfire, gear, exploration, adventure, survival"
0a323c92-e4af-58bd-968b-0c25484c7e6f,"Cuisine, Menu, Reservation, Ambiance, Service, Dining, Appetizers, Entrees, Dessert, Rating"
58859c56-9464-5305-a374-c66656834d1a,"fitness, coordination, endurance, cardiovascular, agility, interval training, muscle toning, balance, weight loss, flexibility"
e9f22822-2d8c-56e5-be8a-f749176ac62d,"strings, chords, melody, rhythm, scales, frets, strumming, pick, tablature, improvisation"
ddcd36b7-b90a-59b5-9987-8a64edbef67c,"strength training, functional fitness, weightlifting, cardiovascular exercise, core stability, mobility training, endurance, resistance training, athletic performance, bodyweight exercises"
316fac7f-4c2d-5c44-9c2a-f5a7473311c3,"rehabilitation, mobility, strength training, flexibility, endurance, cooldown, injury prevention, wellness, physical therapy, rejuvenation"
6e7bf28d-1dd2-5240-8ce4-a9fa1270047e,"therapy, relaxation, wellness, stress relief, circulation, tension, rejuvenation, mindfulness, holistic, bodywork"
0c932ba7-d9c7-5193-99e9-f62a7aa5cb70,"apnea, respiration, lung capacity, breath control, hypoxia, CO2 tolerance, diving, meditative practice, respiratory efficiency, safety protocols"
9dff5baf-ecad-5093-84c8-4833e33c88b2,"spine, alignment, therapy, adjustment, wellness, pain relief, posture, rehabilitation, mobility, musculoskeletal"
9ace621d-e781-5b77-a523-567a24a1c71d,"Bacteria, Virus, Pathogen, Immune response, Transmission, Contagion, Antibiotics, Infection control, Symptoms, Diagnosis"
2b484716-d543-5638-9fc2-6def3e388e4f,"crafting, home improvement, tools, materials, design, creativity, renovation, tutorial, assembly, decoration"
1bc4d2ee-df42-5f55-ad54-bbee92af6137,"racket, court, serve, volley, match, tournament, baseline, score, rally, referee"
450bb979-7a8e-569b-b6b7-0ba5fec9ba53,"Angling, Bait, Tackle, Rod, Reel, Catch, Lure, Premises, Conservation, Aquatic"
